{
  "model": "EleutherAI/pythia-1.4b",
  "peak_layer": 17,
  "ex_dim": 350,
  "seeds": [
    42,
    43,
    44,
    45,
    46,
    47,
    48
  ],
  "hidden_dim": 2048,
  "protocol": {
    "peak_layer": 17,
    "ex_dim": 350,
    "seeds": [
      42,
      43,
      44,
      45,
      46,
      47,
      48
    ],
    "batch_size": 48,
    "attn_impl": "sdpa"
  },
  "fixed_hp": {
    "per_seed": [
      {
        "seed": 42,
        "linear": 0.11499921022035604,
        "mlp_64": 0.10908071897670095,
        "mlp_128": 0.1408132890954896,
        "delta_64": -0.005918491243655094
      },
      {
        "seed": 43,
        "linear": 0.14312672094836376,
        "mlp_64": 0.11848023403908899,
        "mlp_128": 0.14440367237300253,
        "delta_64": -0.024646486909274776
      },
      {
        "seed": 44,
        "linear": 0.1378222028621956,
        "mlp_64": 0.15480352306322698,
        "mlp_128": 0.12361380820642959,
        "delta_64": 0.01698132020103138
      },
      {
        "seed": 45,
        "linear": 0.1283696848752404,
        "mlp_64": 0.136699854249235,
        "mlp_128": 0.13284030975359254,
        "delta_64": 0.008330169373994611
      },
      {
        "seed": 46,
        "linear": 0.14147216736545104,
        "mlp_64": 0.1425246105549724,
        "mlp_128": 0.153394854835919,
        "delta_64": 0.001052443189521357
      },
      {
        "seed": 47,
        "linear": 0.11901033384786192,
        "mlp_64": 0.1509763723445371,
        "mlp_128": 0.13381436824393417,
        "delta_64": 0.031966038496675175
      },
      {
        "seed": 48,
        "linear": 0.15415846832091734,
        "mlp_64": 0.1278221213688263,
        "mlp_128": 0.13935918729532626,
        "delta_64": -0.026336346952091028
      }
    ],
    "linear_mean": 0.134136969777198,
    "mlp_64_mean": 0.1343410620852268,
    "delta_mean": 0.0002040923080288038
  },
  "swept_hp": {
    "per_seed": [
      {
        "seed": 42,
        "linear": 0.11499921022035604,
        "best_mlp": 0.16768846486014977,
        "best_config": "h=128 lr=0.01 ep=50",
        "delta": 0.05268925463979372
      },
      {
        "seed": 43,
        "linear": 0.14312672094836376,
        "best_mlp": 0.1806109448558151,
        "best_config": "h=64 lr=0.01 ep=20",
        "delta": 0.03748422390745135
      },
      {
        "seed": 44,
        "linear": 0.1378222028621956,
        "best_mlp": 0.18139800299679162,
        "best_config": "h=64 lr=0.01 ep=50",
        "delta": 0.04357580013459603
      },
      {
        "seed": 45,
        "linear": 0.1283696848752404,
        "best_mlp": 0.19917627651801142,
        "best_config": "h=128 lr=0.01 ep=50",
        "delta": 0.07080659164277103
      },
      {
        "seed": 46,
        "linear": 0.14147216736545104,
        "best_mlp": 0.18384613216002077,
        "best_config": "h=128 lr=0.01 ep=50",
        "delta": 0.04237396479456973
      },
      {
        "seed": 47,
        "linear": 0.11901033384786192,
        "best_mlp": 0.17429982725313406,
        "best_config": "h=64 lr=0.0001 ep=20",
        "delta": 0.055289493405272144
      },
      {
        "seed": 48,
        "linear": 0.15415846832091734,
        "best_mlp": 0.16913470055459243,
        "best_config": "h=64 lr=0.0001 ep=20",
        "delta": 0.014976232233675085
      }
    ],
    "best_mlp_mean": 0.1794506213140736,
    "delta_mean": 0.045313651536875575
  },
  "swept_hp_holdout": {
    "protocol": "fit on train, select HP on wikitext validation, report on wikitext test",
    "grid": {
      "hidden": [
        64,
        128
      ],
      "lr": [
        0.01,
        0.001,
        0.0001
      ],
      "epochs": [
        20,
        50
      ]
    },
    "per_seed": [
      {
        "seed": 42,
        "linear_test": 0.10770958425412847,
        "best_val_rho": 0.16768846486014977,
        "best_mlp_test": 0.15737621400477309,
        "best_config": "h=128 lr=0.01 ep=50",
        "delta": 0.04966662975064462
      },
      {
        "seed": 43,
        "linear_test": 0.13671102479981298,
        "best_val_rho": 0.1806109448558151,
        "best_mlp_test": 0.1762822711118579,
        "best_config": "h=64 lr=0.01 ep=20",
        "delta": 0.03957124631204492
      },
      {
        "seed": 44,
        "linear_test": 0.13448949819130956,
        "best_val_rho": 0.18139800299679162,
        "best_mlp_test": 0.17396595121317218,
        "best_config": "h=64 lr=0.01 ep=50",
        "delta": 0.03947645302186262
      },
      {
        "seed": 45,
        "linear_test": 0.12257764550069418,
        "best_val_rho": 0.19917627651801142,
        "best_mlp_test": 0.1948367202033097,
        "best_config": "h=128 lr=0.01 ep=50",
        "delta": 0.07225907470261551
      },
      {
        "seed": 46,
        "linear_test": 0.1377043459672178,
        "best_val_rho": 0.18384613216002077,
        "best_mlp_test": 0.17352845624229796,
        "best_config": "h=128 lr=0.01 ep=50",
        "delta": 0.035824110275080145
      },
      {
        "seed": 47,
        "linear_test": 0.11294420575930762,
        "best_val_rho": 0.17429982725313406,
        "best_mlp_test": 0.1642697406773858,
        "best_config": "h=64 lr=0.0001 ep=20",
        "delta": 0.05132553491807819
      },
      {
        "seed": 48,
        "linear_test": 0.14886570227372375,
        "best_val_rho": 0.16913470055459243,
        "best_mlp_test": 0.1620534965505339,
        "best_config": "h=64 lr=0.0001 ep=20",
        "delta": 0.013187794276810133
      }
    ],
    "linear_test_mean": 0.1287145723923135,
    "best_mlp_test_mean": 0.17175897857190434,
    "delta_mean": 0.04304440617959087
  },
  "conclusion": "nonlinear_advantage",
  "provenance": {
    "model_revision": "fedc38a16eea3bd36a96b906d78d11d2ce18ed79",
    "script": "scripts/nonlinear_probe.py",
    "timestamp": "2026-04-21T15:49:18+00:00",
    "value_source": "runtime",
    "device": "cuda"
  }
}