{
  "model": "meta-llama/Llama-3.2-3B",
  "peak_layer": 27,
  "ex_dim": 200,
  "seeds": [
    42,
    43,
    44
  ],
  "hidden_dim": 3072,
  "fixed_hp": {
    "per_seed": [
      {
        "seed": 42,
        "linear": 0.10738187563800901,
        "mlp_64": 0.10453037922621138,
        "mlp_128": 0.10143242958593478,
        "delta_64": -0.0028514964117976327
      },
      {
        "seed": 43,
        "linear": 0.10571519089107859,
        "mlp_64": 0.10817884045264572,
        "mlp_128": 0.10259324956968875,
        "delta_64": 0.0024636495615671383
      },
      {
        "seed": 44,
        "linear": 0.09980218797879083,
        "mlp_64": 0.10552049459777428,
        "mlp_128": 0.09489628530425569,
        "delta_64": 0.005718306618983454
      }
    ],
    "linear_mean": 0.10429975150262615,
    "mlp_64_mean": 0.10607657142554379,
    "delta_mean": 0.0017768199229176533
  },
  "swept_hp": {
    "per_seed": [
      {
        "seed": 42,
        "linear": 0.10738187563800901,
        "best_mlp": 0.14666690563823145,
        "best_config": "h=64 lr=0.01 ep=50",
        "delta": 0.039285030000222446
      },
      {
        "seed": 43,
        "linear": 0.10571519089107859,
        "best_mlp": 0.14381949014226592,
        "best_config": "h=64 lr=0.01 ep=50",
        "delta": 0.03810429925118733
      },
      {
        "seed": 44,
        "linear": 0.09980218797879083,
        "best_mlp": 0.15196682453383056,
        "best_config": "h=128 lr=0.01 ep=20",
        "delta": 0.05216463655503974
      }
    ],
    "best_mlp_mean": 0.14748440677144267,
    "delta_mean": 0.043184655268816506
  },
  "conclusion": "nonlinear_advantage",
  "provenance": {
    "model_revision": "13afe5124825b4f3751f836b40dafda64c1ed062",
    "script": "scripts/nonlinear_probe.py",
    "timestamp": "2026-04-13T00:51:33+00:00",
    "value_source": "post_hoc_deterministic",
    "device": "cuda"
  }
}